{
  "id": "monetary_affairs",
  "name": "division.monetary_affairs.name",
  "desc": "division.monetary_affairs.desc",
  "hire_cost": 15,
  "investment": 0.3,
  "channel": "transmission",
  "skill_weights": {
    "forecasting":   0.2,
    "markets":       0.4,
    "supervision":   0.1,
    "communication": 0.2,
    "crisis":        0.1
  }
}
